product,title,rating,content
"100Pcs Disposable Face Masks, Black Face Mask, 3 Ply Disposable Mask",Do not purchase.,1.0,They smell horrible. I purchased them because it was a great deal but now I wish I had reviewed the reviews before purchasing.  I do not know how anyone loves these. I am thankful that I did not spend a lot of money for them.
"100Pcs Disposable Face Masks, Black Face Mask, 3 Ply Disposable Mask",Smells bad,5.0,Smells weird !!
"100Pcs Disposable Face Masks, Black Face Mask, 3 Ply Disposable Mask",Worst quality I've ordered from Amazon,1.0,"Ordered several different kind of masks I usually get multiple layered disposable but I went with these because I was trying to save a couple bucks.Not worth it not worth it at all all I did was completely waste money, these are not usable!!! Now I'm going to have to pay double to get the more expensive ones that I like these were complete 100% out of pocket waste. I might as well just set my money on fire.There's open spaces at my cheeks and under my chin or germs can just fly out into people's faces it does not protect at all. I am vaccinated but I can feel my breath pouring out of the sides and under the chin area of this so I know it is not keeping other people safe from my germs.I went and wasted 10 more dollars on cloth masks to go over this to keep it sealed around my face but as luck has it, I got really bad cloth masks.When I open the container I wasn't paying attention and the cloth masks I got to go over the top don't have a wire for the nose so they don't keep these masks down either. I can still feel my breath going out through the sides and down at my neck.These disposable masks do have a wire but it doesn't help and in a bunch of The masks I checked in The wire only covers like half of one part there's like wire remnants in it or something. Worst quality I ever got I feel like I was robbed. Literally feel like you took the money right out of my hands against my will because you gave me unusable garbage."
"100Pcs Disposable Face Masks, Black Face Mask, 3 Ply Disposable Mask","Finally, a 12 hour mask!",5.0,I’ve been struggling with wearing a mask through my 12 hour shifts at the hospital.  It’s hard to breathe.  One brand Gives me headaches after a couple hours.  Many of them break down after a few hours and your getting fluff in your mouth the rest of the shift.  These masks have eliminated all those problems.  I can comfortably wear this mask for twelve hours straight with no issues.
"100Pcs Disposable Face Masks, Black Face Mask, 3 Ply Disposable Mask",I love this product,5.0,It very comfortable and light weight it's worth every penny
"100Pcs Disposable Face Masks, Black Face Mask, 3 Ply Disposable Mask",Hard to beat that value,4.0,"Overall very pleased with these. It's hard to beat 100 masks for $10 and they seem to be the same quality as other surgical-style masks so I'm happy with them and will definitely buy them again if I run out of them. The only slight issue I've had is that they have an unpleasant metallic smell right out of the bag, it mostly dissipates after a few minutes but if you're particularly sensitive to smells it may bother you."
"100Pcs Disposable Face Masks, Black Face Mask, 3 Ply Disposable Mask",nice fit,5.0,"these are thinner than the ones with the white on the inside but i think that’s what makes them more breathable. it depends on your skin sensitivity, but i think these are good & they don’t irritate me as other masks would."
"100Pcs Disposable Face Masks, Black Face Mask, 3 Ply Disposable Mask",Stylish mask,5.0,I love these face mask. They coordinate well with my wardrobe. They don’t draw attention like wearing those blue mask. Even though I know that wearing mask is what is normal now. It’s just something about having a more basic black mask that I love.
"100Pcs Disposable Face Masks, Black Face Mask, 3 Ply Disposable Mask",Affordable,5.0,Perfect size and color!
"100Pcs Disposable Face Masks, Black Face Mask, 3 Ply Disposable Mask",MASK BAG WAS WIDE OPEN. GROSS!!,1.0,"My mask just arrived and I cut the Amazon envelope, when I opened it, the mask bag is wide open. This is supposed to be mask for health reason. How can I trust this mask if it was wide open. Not closed at all! Disgusting and so unsanitary. Gross! Look in the photo!!!"
"100Pcs Disposable Face Masks, Black Face Mask, 3 Ply Disposable Mask",Smells like a skunk,1.0,Just bought. Came open package. Smells like a skunk just sprayed all over it. Had to put it the trunk to return it after work because it stunk up my car. Don’t buy this product! You’ll regret it.
"100Pcs Disposable Face Masks, Black Face Mask, 3 Ply Disposable Mask",Not the same as before,2.0,"I have ordered these 4 times since spring- specifically selecting “reorder” each time so I was getting the same. They were really great quality in spring, so when the price was good in June I reordered.  I understand supply and demand,  so I wasn’t shocked to an increase when I ordered for the 3rd time as the start of school neared, but thought the 200+% increase was a bit excessive. The packaging was different but the product seemed similar. I ordered again this week to replenish my dwindling stock. It was up another $1.00, the packaging was, again, different, and this time the product is very sub-par. It looks similar, but it’s about half the thickness, the ear loops are thinner and feel less sturdy and the nose piece is not as solid. The original quality which kept me reordering is definitely gone, and add to that the price increase- I will not be repurchasing."
"100Pcs Disposable Face Masks, Black Face Mask, 3 Ply Disposable Mask",Stylish and awesome,5.0,I love the appearance of these masks and they are very well made! I cant tell you how many times the bands have snapped when I have used to traditional and cheaper white masks.
"100Pcs Disposable Face Masks, Black Face Mask, 3 Ply Disposable Mask",5 masks broke in a span of 5 hours,1.0,These masks are JUNK!! I had 5 break on me in a span of 8 hours! I have to wear a mask at work and would like to not have to change it out every couple of HOURS!! Do not buy!! They are not made durable!
"100Pcs Disposable Face Masks, Black Face Mask, 3 Ply Disposable Mask",Latina mom approved,5.0,"Mom wanted new facemasks, but got some colored ones at her work that smelled like chemicals. These, however, did not smell at all, except for that ""fresh off the press"" factory smell, but that is about it.If you like to wear black all the time and need facemasks that are worth the money, these are the ones. 10/10, only issue is that they don't come in a 1000 piece bulk pack. Still, 2x 50 piece resealable bags are great for the average consumer.As an IT specialist visiting many homes and offices, although I need to change masks very often to avoid cross-contamination, I've bought these many times over just because the quality is consistent, even after four months of continuous buying. Great product. And yes, even if you're vaccinated like I am, please wear a mask :)"
"100Pcs Disposable Face Masks, Black Face Mask, 3 Ply Disposable Mask",Horrible Smell,1.0,I’m not the one to write bad reviews but in this case I apologize. Yes is a great deal but is not worth it. I received this mask on Monday 7/27/21 and only use one ( same day I received it) I had to sprayed it to get rid of the horrible smell… few hours later I ended up with a horrible headache is been 4 days and I’m still experiencing horrible headaches. I don’t recommend it!!! and they are not soft kind of itchy too.
"100Pcs Disposable Face Masks, Black Face Mask, 3 Ply Disposable Mask","Unpleasant odor, no way can be used",1.0,These masks have a strong plastic odor. Awful!!!
"100Pcs Disposable Face Masks, Black Face Mask, 3 Ply Disposable Mask",Worst masks I have ever worn!!!,1.0,"These have got to be the worst masks I have ever bought and worn! First the elastic breaks easily, and even tho I have a big head I have only had the elastic break of masks, different brands, on 3 occasions since COVID started. With these masks it has happen 4 times in a bit more than 24 hours! Aside from the flimsy engineering, the second thing that sucks about them is this disgusting chemical smell on the mask. I’m not sure what they smell like but it’s gross. The smell also stays on your skin so even after you take it off the smell lingers and a long time you almost need to wash up every time!If you are looking for masks these are not it!"
"100Pcs Disposable Face Masks, Black Face Mask, 3 Ply Disposable Mask","Comfortable, nice fit",5.0,"I teach in an all day preschool and have to wear masks all day. I used to wear just cloth masks, but some of them are too thick for me to communicate clearly with the children and my coworkers. I like the weight of these. I feel protected (the children 2 & up also wear masks). I like the black better than the plain blue doctors’ style. These have a flat, flexible nose wire to fit then close to my face. I wear glasses so that’s important to prevent the glasses from fogging up.I am very sensitive to textures and smells. These masks do not have an odor that I’ve noticed.I have a relatively small face. My husband has an average-large face. These fit bit of us well."
"100Pcs Disposable Face Masks, Black Face Mask, 3 Ply Disposable Mask",The worst do not buy the majority of the mask don’t have ear straps extremely bad quality !!!!,1.0,"The media could not be loaded.
                




   Very bad quality, monear straps waste of money do not buy !"
"100Pcs Disposable Face Masks, Black Face Mask, 3 Ply Disposable Mask",Don’t buy!!!!,1.0,"Video Player is loading.Play VideoPlayMuteCurrent Time 0:00/Duration 0:00Loaded: 0%Stream Type LIVESeek to live, currently behind liveLIVERemaining Time -0:00 1xPlayback RateChaptersChaptersDescriptionsdescriptions off, selectedCaptionscaptions and subtitles off, selectedAudio TrackFullscreenThis is a modal window.



   Terrible product. 6 out of the first 7 I tried to put on snapped😠. 2 taking them out of the package. The one that worked broke while I was wearing it in the store🤬. Used up 20 of them going shopping. Very displeased and am returning. That quality of straps make me wonder how good the materials really are in the mask😳."
"100Pcs Disposable Face Masks, Black Face Mask, 3 Ply Disposable Mask",Too thick,3.0,They seem too thick actually. I wear them to make others feel better and because I have to wear them at work and on the airplane (I travel a lot). But realistically I’d rather it be as thin as possible and more comfortable for me.UPDATE: And the strap has broken on every other one.
"100Pcs Disposable Face Masks, Black Face Mask, 3 Ply Disposable Mask",Best masks?,3.0,"I bought these for the first time in April, I did not realize how good the masks were until I ran out and bought 2 other brands similar. They did not compare!Update: I ordered more and when they arrived they were not in the same packaging (see pic) or same quality. The first ones came in the teal package, the second ones came in the white packaging.I will be returning."
"100Pcs Disposable Face Masks, Black Face Mask, 3 Ply Disposable Mask",DO NOT BUY!! AWFUL CHEMICAL SMELL and received opened returned package,1.0,Package came ripped open as if it had been opened and returned! I then opened to check out the masks and they have a STRONG SMELL of chemicals! My guess that's why they were returned to begin with! Who does quality control in the order filling department? Why are sealed products like disposable masks that have been CLEARLY ripped opened and returned put back on the shelves for resale???
"100Pcs Disposable Face Masks, Black Face Mask, 3 Ply Disposable Mask",VERY STRONG CHEMICAL SMELL!,2.0,"The ones I purchased had a very, very strong chemical smell! It was overpowering!  There is no way I can use these, so I will be returning them. I do see where some reviews mention a strong chemical smell and others don't. I also noticed that pictures posted for these particular masks show totally different packaging than the ones I received. I'm thinking the packages of masks differ from customer to customer, depending on what's available at the time of sale.  I did buy another box of black masks from another seller that did not have any smell whatsoever, so I know it can be done. I wish I would have bought more of those, because, unfortunately, those are no longer available."
"100Pcs Disposable Face Masks, Black Face Mask, 3 Ply Disposable Mask",Poor Quality: Ear loops break immediately!,1.0,"I am a high school teacher and I bought these because students often ask me for a mask in my classroom to replace an uncomfortable, ill-fitting, or broken mask (or if they forgot one). I had bought black disposable masks before that worked fine, and they thought black ones were cooler than the standard blue ones for some reason. This time, these masks seem so much more cheaply made and I feel they’re a complete waste of my money. Multiple times, I’ve had a student go to put one on and the ear strap immediately broke. I don’t know if I just got a bad batch or what. Very disappointed!"
"100Pcs Disposable Face Masks, Black Face Mask, 3 Ply Disposable Mask",Must have mask - no more mask acne,5.0,"Disposable mask that isn’t an eyesore. I was purchasing cute linen and silk masks, but my face was having severe chin break outs. I switched to these and my skin has cleared back up. I do not have acne prone skin. I can also make these fit my children, the ear loops are very soft and stretchy, so I make little loops to make them smaller- kid size. Great price, too!"
"100Pcs Disposable Face Masks, Black Face Mask, 3 Ply Disposable Mask",It had one job…,1.0,"I bought these for my teenage son to wear to school. They are very thin, the elastic straps come loose, and the nose clip doesn’t seem to stay in place! The sides won’t stop flapping out. We had purchased some great ones through Longpala, but they don’t seem to be available. Wearing this all day is a frustrating experience. He said it would be better to tape paper to his face. Returning."
"100Pcs Disposable Face Masks, Black Face Mask, 3 Ply Disposable Mask",Smells extremely toxic and wouldn’t recommend it,1.0,The masks smell like they just got out of the manufacturer’s to the point that it’s unbearable to wear since it smells so toxic. I want a refund.
"100Pcs Disposable Face Masks, Black Face Mask, 3 Ply Disposable Mask",Terrible. Do not buy,1.0,"I should have known better based on the price.  These were terrible.  I couldn’t get past the packaging. I looks like someone grabbed a stack of masks, shoved them into a plastic bag and taped it shut. It wasn’t even sealed shut.  Parts of the bag were open near the top where the tape didn’t cover and there was a small hole on one side.  Which means they were exposed.  I returned.  I’ll spend a little more and get good quality."
"100Pcs Disposable Face Masks, Black Face Mask, 3 Ply Disposable Mask",Contains Unkown Chemicals,1.0,"These were purchased a couple weeks ago, I bought them for my 11yr old to wear to school. She wanted a different color then they hand out at school, so we went with the black as black goes with everything. She told me first day that she could smell what kind of smells like cough medicine coming from them. I reassured her that it was probably the type of material and I wore one for a day and all seemed well just a little funky. 2 weeks later my daughter now has red itchy and irritated eyes. At first I contacted her dr, we treated her for pink eye, no change, then was told it must be an allergy in the air from wind and weather, tried allergy antihistamine eye drops only to discover and realize that she does not have symptoms the days that I keep her home from school because they are so bad. By then end of the day she has not worn them, her eyes are almost normal, I send her back to school and she returns home with red irritated eyes. She says she can’t even smell them anymore. She’s gotten used to it. Geez I feel like a horrible mother at this point. Long story short, don’t buy these unless you’re ok with chemical irritants. I’m so thankful e finally figured this whole thing out, switched to different masks the last couple of days and we are back in business."
"100Pcs Disposable Face Masks, Black Face Mask, 3 Ply Disposable Mask",Don't buy these masks!,1.0,"I bought these masks on Amazon because the ones I usually buy are out of stock.Do not buy these masks!!!* Some, the ear string are broken out of the bag.* Some, the ear string breaks while you are wearing the mask.* Some, the wire that keeps the mask at your nose pops throught the mask -- right near your eye!!!! Dangerous!!!While most of the masks are perfectly wearable, the need to run back to the car for a new one or the risk of poking an eye out... no, no, no.I bought several packets to get me through the winter. Wish I could return them."
"100Pcs Disposable Face Masks, Black Face Mask, 3 Ply Disposable Mask",Stinky!,3.0,The chemical smell was overwhelming when I opened the package. I still had some of the ones I usually buy so I aired these out for a couple days before using them. They're fine now but I'm still a bit worried about what chemicals were on there. I can feel some kind of coating on them. They fit pretty good and the elastic is comfortable. The nose strap (is that what it's called?) keeps them in place. I only bought these because my usual brand was out of stock. I'll use these but I won't buy them again.
"100Pcs Disposable Face Masks, Black Face Mask, 3 Ply Disposable Mask",95% garbage.,1.0,"These are extremely poor quality. The top left strap rips off the mask on 75% of them. The straps are that horrible flat thin material that hurts the back of your ears. The metal strip is basically a spring steel, meaning you can’t form it to your nose to make a seal. (Yay foggy glasses every single time….)These are garbage. I hate when people sell actual garbage. And I really hate when I pay real money for garbage."
"100Pcs Disposable Face Masks, Black Face Mask, 3 Ply Disposable Mask","They’re masks, but they seem to fit loosely and it was confusing which way they went.",4.0,"I’m immunocompromised so I’ve been wearing masks while flying commercial(like a 10 hour flight where between the airport and the actual flight I wore a different but similar style mask for over 12 hours, doctor’s and all medical appointments since way before COVID was a thing(around 5-7 years prior to the pandemic) so I’m pretty used to wearing masks. Did my immunocompromised status I can’t wear cloth masks because you have no way of knowing if they’re really blocking anything so my hematologist told me I had to wear disposable masks(which I pretty much already knew.) I know these work well since they caused me to have an elevated oral temperature of 102.5 when it was taken at my rheumatologist’s office, which quickly lowered to normal after they had me go mask free for several minutes, so I know they’re doing their job. These are lightweight and it’s easy to forget you’re wearing them. My 18 year old son went for bloodwork and forgot he had it on until I told him he didn’t need to wear it in my car unless he thought I had COVID. I’ve also forgot I’ve had it on so they are definitely comfortable. Well as comfortable as a mask can be and let’s face it, that’s not very comfortable. They appear to work although I find them rather loose. Also when I first got them it was slightly confusing which way they went. Normally masks have a white side and a blue side so it’s easy to know which way they go but these are the same exact color on both sides so it was slightly confusing at first to figure out which way they were supposed to go(due to COVID and masks being in short supply when it first started  I’ve been wearing a different style of disposable mask than these ‘traditional style’ masks.) I finally figured it out to get the tightest fit possible even though they still feel too loose but that also could be because of the type of disposable masks I had been using as they fit a lot tighter than this style. I do notice my glasses fogging a lot more(not really often but often enough to be slightly annoying) no matter how tight I make the bridge of the nose which is annoying(and I rarely have that problem since I’ve become an expert at tightening them well at the bridge since, as I said before, I’ve had to wear masks for 5-7 years before COVID made everyone wear a masks.) All in all they’re a good mask and, except for what I’ve mentioned, they’re great and is definitely recommend them."
"100Pcs Disposable Face Masks, Black Face Mask, 3 Ply Disposable Mask",Not very easy to breathe during workouts,3.0,"I bought these masks for the first time because my usual ones were out of stock. They are a little tighter on the ear loops, which I like. It fits better than my usual ones. But the material is the same on both sides, which is fine, but I wish the material that touches my skin was softer. The biggest issue I have with these masks is that it's harder to breathe during workouts. My usual masks are thicker but a lot more breathable. I guess these would be ok if I didn't wear it during exercise, but I'm going back to my old masks as soon as they come back in stock."
"100Pcs Disposable Face Masks, Black Face Mask, 3 Ply Disposable Mask",Ear Loops Separating from Mask,2.0,"5 of the last 10 masks that I have used from this order, the ear loops broke when I went  to put them on. So frustrating."
"100Pcs Disposable Face Masks, Black Face Mask, 3 Ply Disposable Mask",Been buying for over a year this last batch was awful,1.0,"I don’t know if they change manufacturers or material they use to make them. But I have literally bought hundreds of these because my mask mandate at work has never dropped and I work long hours and wear at least two a shift. This last batch of 100 that I ordered is itchy, rough material, and the ear loops are a lot shorter and hurt within a half hour. Going to buy locally, disappointed"
"100Pcs Disposable Face Masks, Black Face Mask, 3 Ply Disposable Mask",Not the same batch,3.0,"Kind of disappointed with the mask quality. I ordered a pack of 100 in 2021 and the masks were good quality, see picture mask on the right. I received the second package two days ago and I immediately noticed something was wrong. The package was different than the one received in the first order. And look mask on the left, the mask is so thin it lets the light through. Returning this product immediately."
"100Pcs Disposable Face Masks, Black Face Mask, 3 Ply Disposable Mask",Breathable and goes with everything,5.0,"I go for the black masks because they go well with everything. Its pretty comfortable, and I haven't rain into any issues with durability either. To be honest though, the actual filtration of the mask is not the best (based on deep inhalation/exhalation test). I'd say it's probably more fit for the people who wear a mask because it's required or ""just because."" If you are looking to make a fashion statement or you're really hoping to protect yourself from oral secretions and illness, this might not be your best bet."
"100Pcs Disposable Face Masks, Black Face Mask, 3 Ply Disposable Mask",Not the same thing,3.0,"As others, I ordered again. They are not the same.Not in a box. Not the same fabric. Not the same metal strip on the nose.It still has that same paper stamp for our future supreme overlords though.....OK enough to keep but if ""the apocalypse"" gets renewed for a season three ....I will look elsewhere."
"100Pcs Disposable Face Masks, Black Face Mask, 3 Ply Disposable Mask",The BEST,5.0,"Pros: These mask are far my favorite. I have a larger face and the mask is stretchable and comfortable. The straps does not hurt around my ears and I can wear the mask all day with great comfort. It's super light weight and I'm able to breath.Cons: Some of the straps on the masks were broken. For my batch, I found 5 mask with broken straps but it wasn't a big deal for me. Also, there's a smell to the mask. The smell isn't bad or toxic, but if you're sensitive to smell, you may want to pass on buying these mask."
"100Pcs Disposable Face Masks, Black Face Mask, 3 Ply Disposable Mask",Ugh:,2.0,"So I’m an RN and have been wearing masks for 12+ hour shifts for over a year and a half now. Couldn’t deal with the blue hospital masks my job provides because I have very sensitive skin. Those blue ones make my face itch like crazy and even causes it to become raw and painful. I started buying my own and have been a black mask faithful because I just could not tolerate it anymore. I was in tears by the end of my shifts. This is the first pack of black masks I’ve gotten in over a year that I didn’t love. I hate leaving negative reviews but these ones smell weird, are really stiff, and make my face itch like crazy. All reasons I don’t wear the blue ones my job provides. I don’t know…just a tad disappointed. Otherwise I really do appreciate the speedy shipping. Just not crazy about these masks. :("
