product,title,rating,content
"100Pcs Disposable Face Masks, Black Face Mask, 3 Ply Disposable Mask",Comfortable and affordable masks,5.0,Easy to wear for the whole day. Only issue you might have is that the strap might not be secured and snap off on a few of them. Otherwise a great choice for mask requirements.
"100Pcs Disposable Face Masks, Black Face Mask, 3 Ply Disposable Mask",Great value and safety,5.0,I wish that it was easier to figure out what side goes out and what touches your face. Other than that the product is great.
"100Pcs Disposable Face Masks, Black Face Mask, 3 Ply Disposable Mask",They smell BAD,1.0,These mask smell like a dead fish when you put them on. It does not go away and it’s hard to ignore since they are right over your nose. Look for another brand.
"100Pcs Disposable Face Masks, Black Face Mask, 3 Ply Disposable Mask",Flimsy,3.0,These masks are flimsy. Not only that but the ear bands seem to fall off at the slightest tug or pool. Not what I expected.
"100Pcs Disposable Face Masks, Black Face Mask, 3 Ply Disposable Mask",No Quality Control,2.0,"You get what you pay for. There are probably 50 good masks in the 100. The nose wire in many is stuck at one side and not in the middle or is not present at all. The ear loops are not well attached and frequently break loose. I wasn't expecting much, I didn't get much. But they are breathable and light-weight."
"100Pcs Disposable Face Masks, Black Face Mask, 3 Ply Disposable Mask",Cheap,2.0,"The wire above the nose that should conform to your nose doesn’t. It doesn’t stay in place so if you wear glasses, it’s awkward.  These are fine for a quick run in and out of somewhere but not to wear for any length of time."
"100Pcs Disposable Face Masks, Black Face Mask, 3 Ply Disposable Mask",The straps break!,5.0,The strap breaks as soon as I put the mask on. I’ve been through 30 in a couple of days. Of course I should’ve purchased the ones I’ve gotten in the past but trying to save money I got these. Don’t waste your money.
"100Pcs Disposable Face Masks, Black Face Mask, 3 Ply Disposable Mask",Paper,2.0,If u like very thin to nothing then this will work and this won’t Protect you ! But they are very thin .. kids like it because it’s like wearing nothing
"100Pcs Disposable Face Masks, Black Face Mask, 3 Ply Disposable Mask",Nose clip/wire doesn't work,2.0,"Bought these earlier in the year, unfortunately a 100 masks total, and every single mask's nose wire is useless. They don't bend to the shape of your nose if you pinch it like other masks do. They don't fit snug at all in this area, and it the wire feels more like plastic. Masks are supposed to fit snug and not let air escape to serve their purpose. I wear a fabric mask with a nose wire over one of these so they won't go to waste."
"100Pcs Disposable Face Masks, Black Face Mask, 3 Ply Disposable Mask",Good disposable face masks at a great price!,5.0,Great price for 100 disposable face masks in black!  Packaged very well and has a certified sticker that comes with it.
"100Pcs Disposable Face Masks, Black Face Mask, 3 Ply Disposable Mask",Lightweight,3.0,I like the black color & the lightweight material.  The straps are a little bit shorter than the ones I bought at Costco.
"100Pcs Disposable Face Masks, Black Face Mask, 3 Ply Disposable Mask",Excellent quality and value.,5.0,Excellent quality mask. Our choir used them in a concert this week and they looked very professional with the choir wearing black clothing for a uniform look. The masks were an excellent value. I will definitely buy them again.
"100Pcs Disposable Face Masks, Black Face Mask, 3 Ply Disposable Mask",Possible eye irritant for sensitive skin,2.0,"My partner and I both have sensitive skin and these irritated our eyes. We both noticed that our eyes became itchy after sometime wearing this, in the corners of our eyes. They have a bit of a weird smell too out of the package. The smell goes away quickly though, and they're honestly pretty comfortable. They don't fog my glasses either. If you have sensitive skin these might not work for you, but I don't think they're bad"
"100Pcs Disposable Face Masks, Black Face Mask, 3 Ply Disposable Mask","Great masks, perfect fit, NO ODOR!!",5.0,"Soo glad I took a chance besides negative reviews . Most importantly to note is there is NO ODOR !! Fit is perfect, stretchy ear bands are comfortable, not tight at all. Wish they were individually wrapped..but I put them in ziploc bag.Great purchase. timely delivery as described  !!"
"100Pcs Disposable Face Masks, Black Face Mask, 3 Ply Disposable Mask",Garbage,1.0,"I purchased these masks after wearing another brand’s black mask almost since the beginning of the pandemic. Out of using five, three have ended up like this with a twisty tie coming out of the nose. These are a poor quality do not order. I NEVER once had this happen when using  another brand for over one year. GARBAGE"
"100Pcs Disposable Face Masks, Black Face Mask, 3 Ply Disposable Mask",Value brand but good quality,5.0,"Had an event and needed to order masks for those that ""forgot"" theirs. These worked out perfectly. I dont think they'd be good for multiple uses but we're getting for my need."
"100Pcs Disposable Face Masks, Black Face Mask, 3 Ply Disposable Mask",Good mask but a little small for adults,3.0,These are good masks but the size is small for adults. My teen daughters like them for school but they also complain about them being to small
"100Pcs Disposable Face Masks, Black Face Mask, 3 Ply Disposable Mask",Plastic nose piece,1.0,Purchase two times prior- the third time it was obvious the metal noes piece was switched out for a plastics noes piece. Don’t waste your money.
"100Pcs Disposable Face Masks, Black Face Mask, 3 Ply Disposable Mask",Chemical smell,4.0,Will buy again
"100Pcs Disposable Face Masks, Black Face Mask, 3 Ply Disposable Mask",Don't leave home with just 1,2.0,"About one in five of these will have the earloop band detach from the mask unexpectedly. Fortunately, most of the time it happens as you're putting the mask on. But sometimes, you've left home and are going into a store, or already in the store, when it fails.  And these failures are occurring with my 13yr old daughter, so its not like we're trying to strap these on to a watermelon."
"100Pcs Disposable Face Masks, Black Face Mask, 3 Ply Disposable Mask",Perfect for school,5.0,"These are the only masks my teens will wear. Light weight, disposable. Will continue to buy until COVID decides to disappear."
"100Pcs Disposable Face Masks, Black Face Mask, 3 Ply Disposable Mask",Great!,5.0,I have ordered this great deal on masks a few times. The nose clip is comfortable and the masks are breathable. Work great with glasses!
"100Pcs Disposable Face Masks, Black Face Mask, 3 Ply Disposable Mask",Great quantity with low quality straps,3.0,"I like that they were not expensive, however the masks did break every day. I recommended having an extra close by just in case."
"100Pcs Disposable Face Masks, Black Face Mask, 3 Ply Disposable Mask",Great for everyday use,5.0,"We live in an area where mask are required pretty much all the time. I keep a supply of clean masks by the front door for my family so it is convenient to grab on the way out. The price for 100 masks was great, shipping was fast, and the masks were exactly as I expected them to be. Would recommend, will order again."
"100Pcs Disposable Face Masks, Black Face Mask, 3 Ply Disposable Mask",Needs improvement,1.0,Usually I try so hard not to be harsh and believe other reviews but wth? I just opened it since I finally ran out of the other mask I have (different brand btw) and most of these mask are missing the strap. Yeah that’s no fun when you’re looking mask after mask to see if it’s good or not.
"100Pcs Disposable Face Masks, Black Face Mask, 3 Ply Disposable Mask",nose wire doesn’t work,1.0,the nose wire at the top is super uncomfortable and doesn’t bend enough so fit a nose. definitely not covid-safe
"100Pcs Disposable Face Masks, Black Face Mask, 3 Ply Disposable Mask",Cheap quality,2.0,I wish I would have just repurchased from a different seller. You can feel how thin and chintzy these are as soon as you open the bag. I guess I'll shove these in the back of a drawer for emergency use only.
"100Pcs Disposable Face Masks, Black Face Mask, 3 Ply Disposable Mask",Fit,4.0,...The mask on my face seems too small would fit a child perfectly. Not for average older male with long face.
"100Pcs Disposable Face Masks, Black Face Mask, 3 Ply Disposable Mask",Useless - do not buy - break so easily and come broken,1.0,"These were the worst masks I’ve ever purchased. Many came broken and most of them have broken within a couple minutes of wearing them. Plus the material feels really harsh on your face. Don’t buy these, I’ve bought a different bulk pack of these in the past and they were wayyyy better."
"100Pcs Disposable Face Masks, Black Face Mask, 3 Ply Disposable Mask","These masks are poor quality, the elastic for the ear area easily rips. I don’t recommend.",1.0,Cheaply made. Everyday use.
"100Pcs Disposable Face Masks, Black Face Mask, 3 Ply Disposable Mask",Unsanitary,1.0,This product arrived completely wide open. Bag and zip lock all totally open with masks uncovered and all the way exposed. This is SO unsanitary. I do not recommend this purchase.
"100Pcs Disposable Face Masks, Black Face Mask, 3 Ply Disposable Mask",Worth the price but have had more comfortable masks before,4.0,"Overall, the price for what you get is worth it. However, I feel like the mask itself could be a bit more comfortable."
"100Pcs Disposable Face Masks, Black Face Mask, 3 Ply Disposable Mask",Dressy Looking Mask,5.0,"I really like these masks,  I think that they look more dressy than the blue, very happy that I ordered them!!"
"100Pcs Disposable Face Masks, Black Face Mask, 3 Ply Disposable Mask",Does the job but…,3.0,"Does the job but “plasticky” feel to both sides traps moisture, so not comfortable for wear all day or outside when it’s ok. But if you’re inside/ wearing short period of time it works fine."
"100Pcs Disposable Face Masks, Black Face Mask, 3 Ply Disposable Mask",Nicely made but thin.,4.0,I found these comfortable for my face and ears but they feel quite thin. I get more coverage with two masks layered together.
"100Pcs Disposable Face Masks, Black Face Mask, 3 Ply Disposable Mask",No Nose Clip,2.0,I guess the batch I received they missed the nose clip. after using 20 of the masks I realize the last 80 dont have nose clips as described. Be advised.
"100Pcs Disposable Face Masks, Black Face Mask, 3 Ply Disposable Mask","If you have a small face like me, you will have to shorten the ear loops.....",4.0,I bought a whole bunch in order not to run out of masks.  The only thing I do have to do is make a knot on both sides for the earloop.  I have a small face and it is the only way the mask will fit properly.
"100Pcs Disposable Face Masks, Black Face Mask, 3 Ply Disposable Mask",Each mask broke when trying to put it on,1.0,Something is wrong. Each mask strap broke immediately when putting it on. Maybe a bad batch? Returned them.
"100Pcs Disposable Face Masks, Black Face Mask, 3 Ply Disposable Mask",You Get What You Pay For,3.0,"Lightweight and a great value but these masks turn ""fuzzy"" very quickly so I go through multiples in a day because I can't take the feeling of being constantly tickled."
"100Pcs Disposable Face Masks, Black Face Mask, 3 Ply Disposable Mask",Elastic breaks way too easily.,2.0,Not a good value due to ear elastic breaking. Sometimes breaking as soon as you put them on. Sometimes it breaks after a few minutes of wearing it.
"100Pcs Disposable Face Masks, Black Face Mask, 3 Ply Disposable Mask",poor quality,2.0,"Wow, such a quality! 10 pieces without string and the amount of 50. I'm really curious about how the producers expect me to wear it"
"100Pcs Disposable Face Masks, Black Face Mask, 3 Ply Disposable Mask",Crooked,1.0,One of the ear loops is shorter than the other one so they fit on crooked. Guess you get what you pay for.
"100Pcs Disposable Face Masks, Black Face Mask, 3 Ply Disposable Mask",Breaks easily,1.0,Returning these and going back to another product I bought before. 2 of 3 out of the box snapped while putting over ears.
"100Pcs Disposable Face Masks, Black Face Mask, 3 Ply Disposable Mask",Don’t Buy,1.0,Bought these black masks for my 13 & 16 year olds to wear to school. The elastic on the first 6 my oldest put on snapped & mask tore. He found one that stayed together only to have elastic break at school.
"100Pcs Disposable Face Masks, Black Face Mask, 3 Ply Disposable Mask",Doesn’t fit properly,1.0,The nose wire doesn’t bend or stay bent to prevent air flow; uncomfortable ear loops also. The only thing this mask is doing is meeting the requirement to wear a mask. I am quite disappointed.
"100Pcs Disposable Face Masks, Black Face Mask, 3 Ply Disposable Mask",masks are missing a strap on one side!,1.0,Over 30% of the masks are unusable because they are missing a strap on one side! We will be returning this item.When the mask has two straps then it is fine. No issues with the masks when you can actually wear them.
"100Pcs Disposable Face Masks, Black Face Mask, 3 Ply Disposable Mask",Great deal for 100!,5.0,Amazing shipping super fast within a few hours and I love black so very comfy and affordable. Recommend for sure and hope to buy more!
"100Pcs Disposable Face Masks, Black Face Mask, 3 Ply Disposable Mask",My favorite,5.0,These masks feel better than any of the other masks I’ve ever tried. They sit on my face the best and feel very nice and comfortable. There is a slight chemical smell but I find it pleasant. They smell clean and fresh. I’d rather them smell like cleaning chemicals as opposed to mildew and mold.
"100Pcs Disposable Face Masks, Black Face Mask, 3 Ply Disposable Mask",Not durable. There are better options,1.0,I’ve had a lot of them break before use just trying to put them on. I’ve bought better for cheaper. Keep looking.
"100Pcs Disposable Face Masks, Black Face Mask, 3 Ply Disposable Mask",Black disposable mask. Very comfy.,5.0,Love the comfort. Very lightweight and very breathable. Great for school kids. I would definitely recommend.
"100Pcs Disposable Face Masks, Black Face Mask, 3 Ply Disposable Mask",Great masks for $10,5.0,Will definitely be buying more once they run out.I wear glasses and the cloth masks fog up my glasses alot. Plus these actually allow me to be able to breath while wearing them.
"100Pcs Disposable Face Masks, Black Face Mask, 3 Ply Disposable Mask",These are OK in a pinch.,3.0,"As far as disposable masks go, these are just OK. I don't have high expectations but the quality of these masks are much lower than other disposable masks."
"100Pcs Disposable Face Masks, Black Face Mask, 3 Ply Disposable Mask",Super thin,3.0,The first time we bought these they were better quality. Second time around they were so thin and cheap
"100Pcs Disposable Face Masks, Black Face Mask, 3 Ply Disposable Mask",Finally KN95s that are completely comfortable,5.0,Was having trouble finding KN95s that fit well but aren’t too tight around the ears. These are perfect.
"100Pcs Disposable Face Masks, Black Face Mask, 3 Ply Disposable Mask",Terrible on your face,1.0,The first time my son and I wore these I kept thinking how uncomfortable I was. It was so rough on my face but I was pushing through to set a good example for my kid. Eventually I broke and said how much I hated the mask to which he said he was doing the same thing I was. Now I have 98 masks left that we will never use.
"100Pcs Disposable Face Masks, Black Face Mask, 3 Ply Disposable Mask",Ineffective,2.0,"These masks did not reassure me that I was safe going out-n-about on short store runs. I recommend using two or three if you must purchase them, but find something more secure/medical with better filters. The package was awful too; didn’t  seem very sanitary. IMO, not the one!"
"100Pcs Disposable Face Masks, Black Face Mask, 3 Ply Disposable Mask",Works but be ready for the odor,3.0,Works as described but the smell is overwhelming. I've purchased other packages of masks and there usually is an odor but I haven't experienced anything near this strong.
"100Pcs Disposable Face Masks, Black Face Mask, 3 Ply Disposable Mask",Comfortable and sturdy for daily use,5.0,Tried another brand that was slightly cheaper and those mask smelled bad. Also had a white wire for the bend around the nose that popped out of all the mask. However this brand is as expected smells okay and is comfortable and wire stays in place.
"100Pcs Disposable Face Masks, Black Face Mask, 3 Ply Disposable Mask",CHEAP,1.0,"I have not gotten more than 3 or 4 wearings out any of these masks before one of the straps breaks. I know they are disposable, but these are TOO disposable!"
"100Pcs Disposable Face Masks, Black Face Mask, 3 Ply Disposable Mask",Low Quality - Avoid,1.0,"These are low quality masks they come packaged poorly and crumpled. Smell like burnt plastic too, and too thin."
"100Pcs Disposable Face Masks, Black Face Mask, 3 Ply Disposable Mask",I like these best.,5.0,"If I have to wear a mask, which I don’t like, I prefer these. I am not getting acne from the mask with these as I did with my other ones."
"100Pcs Disposable Face Masks, Black Face Mask, 3 Ply Disposable Mask",Horrible quality,2.0,The first mask that I took from the box instantly fell apart when I tried to put it on.
"100Pcs Disposable Face Masks, Black Face Mask, 3 Ply Disposable Mask",Terrible. Straps snap off with very light use,1.0,Terrible product. The straps snap with very light use - I only opened two masks and both of them had the straps snap off with very light use (placing on and off). Absolutely awful product.
"100Pcs Disposable Face Masks, Black Face Mask, 3 Ply Disposable Mask",Great Buy!,5.0,Came rather quickly. Packaged well and traveled well. Works well & offers a bit a fashionable option (as much as one can have).
"100Pcs Disposable Face Masks, Black Face Mask, 3 Ply Disposable Mask",Strings break easily,2.0,"I like the look of these masks and they function fine as masks, but the elastic ear loops on these seem to break so easily that I have to carry a backup around at all times. Better off getting masks with stronger ear loops."
"100Pcs Disposable Face Masks, Black Face Mask, 3 Ply Disposable Mask",Trash,1.0,I ordered this some time ago and the first batch was good. This batch is bad the mask is extremely big and stretched out. I won’t purchase again. Very disappointed
"100Pcs Disposable Face Masks, Black Face Mask, 3 Ply Disposable Mask",Great mask!  It’s comfortable and doesn’t easily break. Very satisfied with this product,5.0,"Light, confort and stretch are as described.  This mask it extremely comfortable on face and elastic around ears.  Highly recommended"
"100Pcs Disposable Face Masks, Black Face Mask, 3 Ply Disposable Mask",Every mask breaks :-/,2.0,"Glad to have some disposable protection in the car for when we forget our masks, but every single one breaks! Sometimes only after a few minutes of wear."
"100Pcs Disposable Face Masks, Black Face Mask, 3 Ply Disposable Mask",Looks good and is comfortable,5.0,Sharp looking black masks. Great price. Perfect for daily use then throw away and use fresh one each day
"100Pcs Disposable Face Masks, Black Face Mask, 3 Ply Disposable Mask",Quality,5.0,First of all you get a ton of masks for this price.. they are good quality and don’t break even in big heads!
"100Pcs Disposable Face Masks, Black Face Mask, 3 Ply Disposable Mask",Don't waste your money,1.0,"We have been wearing masks for over a year now, and I have NEVER had a mask that breaks so easily. Just consider another brand."
"100Pcs Disposable Face Masks, Black Face Mask, 3 Ply Disposable Mask",great value,4.0,Great value would like them to be slightly thicker .Otherwise they do the job and black goes with everything
"100Pcs Disposable Face Masks, Black Face Mask, 3 Ply Disposable Mask",Not protective at all !,1.0,"Video Player is loading.Play VideoPlayMuteCurrent Time 0:00/Duration 0:00Loaded: 0%Stream Type LIVESeek to live, currently behind liveLIVERemaining Time -0:00 1xPlayback RateChaptersChaptersDescriptionsdescriptions off, selectedCaptionscaptions and subtitles off, selectedAudio TrackFullscreenThis is a modal window.



   Not 3 ply ! One layer or fabric super thin. You would have to wear 3 of these mask to be feel any type of protection"
"100Pcs Disposable Face Masks, Black Face Mask, 3 Ply Disposable Mask",Absolutely Garbage,1.0,"These mask are garbage! Thinner that scotts single ply. Metal nose straps either missing or only like a 1"" piece."
"100Pcs Disposable Face Masks, Black Face Mask, 3 Ply Disposable Mask",Not the same,2.0,"Not the same as the masks I purchased 2x before even though it's from the same company. I liked them the past 2x, but not this time. They are smaller than the previous masks and my face was bothered by them. So frustrating."
"100Pcs Disposable Face Masks, Black Face Mask, 3 Ply Disposable Mask",Do not buy these,1.0,"These masks are not packaged properly. The ends were crumbled up and folded. Also, they stink! I’m not putting anything on my face that smells like this. You get a lot of masks for a good price, but what’s the purpose if they are crumbled up and stink."
"100Pcs Disposable Face Masks, Black Face Mask, 3 Ply Disposable Mask",Had a severe allergic reaction from these,1.0,Wore these on a 6 hour flight. The next morning my lips started to blister. They got extremely swollen and were itchy. This went on for a week before I went to urgent care. The doctor said I was having an allergic reaction to the masks I had been wearing. I would not recommend these.
"100Pcs Disposable Face Masks, Black Face Mask, 3 Ply Disposable Mask",Horrible masks! Do not buy!!!,1.0,Does not stretch nor stay up over your nose. It’s hard to describe but they’re not soft and accommodating. I had to throw the entire box away. No one in my family were able to use these! A complete waste of money!
"100Pcs Disposable Face Masks, Black Face Mask, 3 Ply Disposable Mask",Check before wearing,4.0,About 15% of the masks in the last order I purchased did Not have the small metal band that tightens the mask over your nose.  Had to throw them away- quite a waste.
"100Pcs Disposable Face Masks, Black Face Mask, 3 Ply Disposable Mask",Black surgical facial mask,5.0,"I like the product very much.  It’s a light cloth surgical mask and it’s black, which goes with anything your wearing.  Comfortable and for the money great deal!!"
"100Pcs Disposable Face Masks, Black Face Mask, 3 Ply Disposable Mask",Cheaply Made,1.0,Very thin and itchy with zero protection. Don't believe the description. It's like placing black paper on your face.
"100Pcs Disposable Face Masks, Black Face Mask, 3 Ply Disposable Mask",Don’t buy these,1.0,"I’ve ordered multiple masks from Amazon and these have been by far the worst! I’ve read other reviews about them smelling horrible, mine didn’t however, the quality is not great. Between my husband and I, we have had to throw away about 7 total so far because the straps keep breaking before we even put them on."
"100Pcs Disposable Face Masks, Black Face Mask, 3 Ply Disposable Mask",Breakage,3.0,This masks are slippery for those who have glasses and there is some breakage with the string when putting the mask on. Will not buy again.
"100Pcs Disposable Face Masks, Black Face Mask, 3 Ply Disposable Mask",They fall apart,1.0,I’m disappointed in these masks. Half of them dont have the metal insert that tighten the mask on the nose and the others fall out when wearing them. Otherwise they break when wearing. I can barely use it for a day.
"100Pcs Disposable Face Masks, Black Face Mask, 3 Ply Disposable Mask",50% Break,2.0,"Unfortunately, cannot use. When putting on, elastic strings break when trying to secure to face. Definitely need better reinforcement."
"100Pcs Disposable Face Masks, Black Face Mask, 3 Ply Disposable Mask",Horrible,1.0,"These mask suck ; i cannot believe it’s 2PM and I’ve already went through 8 mask! The strings break off at the slightest movement , i want a refund !"
"100Pcs Disposable Face Masks, Black Face Mask, 3 Ply Disposable Mask",Great face masks,5.0,These are perfect for a sales field rep like me who has to grab a face mask a few times a day.
"100Pcs Disposable Face Masks, Black Face Mask, 3 Ply Disposable Mask",Perfect for work,5.0,"My wife needs to wear a mask for work, and she loves these ones. They are comfortable to wear all day, and the black color looks sharp."
"100Pcs Disposable Face Masks, Black Face Mask, 3 Ply Disposable Mask",Not great quality but good to have on hand,3.0,"Second time buying. First order was good, next order’s quality was sub par. Just a plain old black mask."
"100Pcs Disposable Face Masks, Black Face Mask, 3 Ply Disposable Mask",Good masks,5.0,Basic face masks. They don’t break easily like some of the other masks. Great to have on hand.
"100Pcs Disposable Face Masks, Black Face Mask, 3 Ply Disposable Mask",Smell,4.0,"These are perfect for backups in your vehicle, work or purse. I have 4 stars because there’s a chemical smell on the mask. Would not wear directly on my skin."
"100Pcs Disposable Face Masks, Black Face Mask, 3 Ply Disposable Mask",Kinda itchy,3.0,"I like that they are black they fit nice but kind of itchy, We'll keep in the car as backup"
"100Pcs Disposable Face Masks, Black Face Mask, 3 Ply Disposable Mask",Great fit for the price. I would buy again.,5.0,"The mask is fine overall. It could be a little larger but, it does fit an adult. I would buy again."
