product,title,rating,content
"100Pcs Disposable Face Masks, Black Face Mask, 3 Ply Disposable Mask",Comfortable and Breathable,5.0,"These are durable, comfortable, and easy to breath through.  Fast shipping and worth the money!!!!"
"100Pcs Disposable Face Masks, Black Face Mask, 3 Ply Disposable Mask",Fits good,5.0,Convenient to have in car
"100Pcs Disposable Face Masks, Black Face Mask, 3 Ply Disposable Mask",👍🏼,5.0,Great price quick shipping
"100Pcs Disposable Face Masks, Black Face Mask, 3 Ply Disposable Mask",Nose clip won't adjust mi,2.0,Bad nose clip
"100Pcs Disposable Face Masks, Black Face Mask, 3 Ply Disposable Mask",Do not buy,1.0,"The mask is paper thin, and smells like chemicals. Took way too long to get here. Will not reorder, will not recommend. Also the box it came in was destroyed."
"100Pcs Disposable Face Masks, Black Face Mask, 3 Ply Disposable Mask",good quality,5.0,well made
"100Pcs Disposable Face Masks, Black Face Mask, 3 Ply Disposable Mask",They changed the string size,2.0,That pic is from the 1st time i got the and now. It doesn’t fit me anymore
"100Pcs Disposable Face Masks, Black Face Mask, 3 Ply Disposable Mask","The first I used when I was going to take i of, the elastic broke.",4.0,Too weak
"100Pcs Disposable Face Masks, Black Face Mask, 3 Ply Disposable Mask",Very pleased,5.0,Very pleased
"100Pcs Disposable Face Masks, Black Face Mask, 3 Ply Disposable Mask",Hard and scratchy on the face,1.0,have purchased many disposable masks. These chap our faces and are very hard compared to most. DO NOT BUY
"100Pcs Disposable Face Masks, Black Face Mask, 3 Ply Disposable Mask",Comfortable and doesn't rub makeup off.,5.0,"These hold up a lot better than the usual blue and white disposable masks! They don't fray and fuzz through the day. They're still light weight and comfortable though! My makeup likes these masks better, they dont make your face humid and ruin your makeup :) Highly recommend"
"100Pcs Disposable Face Masks, Black Face Mask, 3 Ply Disposable Mask",Paper thin,1.0,They are very thin layers of “protection”.I would not recommend
"100Pcs Disposable Face Masks, Black Face Mask, 3 Ply Disposable Mask",Recomend,5.0,Great Quality and very good Value.  Makes life easier to have handy in several locations.
"100Pcs Disposable Face Masks, Black Face Mask, 3 Ply Disposable Mask",They work,5.0,Like product and use and a daily basis
"100Pcs Disposable Face Masks, Black Face Mask, 3 Ply Disposable Mask",Thin,1.0,These masks are thin.
"100Pcs Disposable Face Masks, Black Face Mask, 3 Ply Disposable Mask",Not very comfortable,2.0,This mask feels like stiff and like plastic. The nose wire doesn't hold shape so there isn't a good seal around our noses. I don't think this will do much for PPE.
"100Pcs Disposable Face Masks, Black Face Mask, 3 Ply Disposable Mask",Made me break out,1.0,I’ve been getting black disposable masks for the entire pandemic (never broke out with these masks) and randomly decided to try this brand and I broke out constantly around my chin and neck! Ugh it is horrible. I wish I didn’t order from them.
"100Pcs Disposable Face Masks, Black Face Mask, 3 Ply Disposable Mask",Good,5.0,Comfortable
"100Pcs Disposable Face Masks, Black Face Mask, 3 Ply Disposable Mask",The Mask Smell,1.0,The reviews about the smell is correctThe mask have a very strong smell
"100Pcs Disposable Face Masks, Black Face Mask, 3 Ply Disposable Mask",poor construction,1.0,If I had the original box I would have returned them.  One pack was great. The other pack had masks without the metal nose piece and had ear straps on only one side. What a waste!
"100Pcs Disposable Face Masks, Black Face Mask, 3 Ply Disposable Mask",Nice mask,5.0,Nice thickness. Good fit.
"100Pcs Disposable Face Masks, Black Face Mask, 3 Ply Disposable Mask",Too loose and some smelled bad…,2.0,"It’s kind of weird because we have ordered these before and did not have the same issues. The masks in this batch were a bit too big and loose, and a few of them smelled bad."
"100Pcs Disposable Face Masks, Black Face Mask, 3 Ply Disposable Mask",Not as advertised,1.0,This is a single ply mask. Very cheap and offers little to no protection.  These are not for anyone serious about protecting  their health.
"100Pcs Disposable Face Masks, Black Face Mask, 3 Ply Disposable Mask",Excelente,5.0,Lo recomiendo
"100Pcs Disposable Face Masks, Black Face Mask, 3 Ply Disposable Mask",the strings keep snapping off,2.0,the strings on this mask tend to snap off easier then any other mask I've owned. some were even broken when I opened the bag. That's a serious issue and I cannot recommend a product with that type of defect.
"100Pcs Disposable Face Masks, Black Face Mask, 3 Ply Disposable Mask",Most don't have a nose bridge,2.0,"Very lightweight masks, however multiple masks ( so far at least ten) have not had a nose bridge. Also one only had one strap."
"100Pcs Disposable Face Masks, Black Face Mask, 3 Ply Disposable Mask",Breathable,5.0,So comfortable
"100Pcs Disposable Face Masks, Black Face Mask, 3 Ply Disposable Mask",masks have a strong chemical odor,1.0,returned the masks....could not wear because of a strong chemical odor
"100Pcs Disposable Face Masks, Black Face Mask, 3 Ply Disposable Mask",Very useful,5.0,Amazing
"100Pcs Disposable Face Masks, Black Face Mask, 3 Ply Disposable Mask",Great Product!,5.0,Great Product!
"100Pcs Disposable Face Masks, Black Face Mask, 3 Ply Disposable Mask",Not worth the purchase,1.0,"These mask are not even 3 ply, it more like one."
"100Pcs Disposable Face Masks, Black Face Mask, 3 Ply Disposable Mask",Nice,5.0,Very nice
"100Pcs Disposable Face Masks, Black Face Mask, 3 Ply Disposable Mask",Elastico de la mascara se desprende con facilidad,2.0,Elastico de la mascara se desprende con facilidad
"100Pcs Disposable Face Masks, Black Face Mask, 3 Ply Disposable Mask",No adjustable nose clip,1.0,I was looking forward to having these. I do appreciate the black color. However I purchased them because the description said it had the adjustable nose clip that helps to keep the mask secure. It does not! They feel cheaply made and don't stay on sans nose clip.
"100Pcs Disposable Face Masks, Black Face Mask, 3 Ply Disposable Mask",Reasonably priced and they are black,5.0,"Fit well , inexpensive and they are black"
"100Pcs Disposable Face Masks, Black Face Mask, 3 Ply Disposable Mask",Breaks constantly.,1.0,"I am a teacher, and wear a mask every day. Within 1 hour of being at school, these masks completely snap off the mask. I have tried 5 different ones, and it keeps happening. DO NOT BUY!"
"100Pcs Disposable Face Masks, Black Face Mask, 3 Ply Disposable Mask",Not 3 ply!,1.0,This mask is one of the worst we have bought since COVID. It is not 3 ply at all and is extremely thin
"100Pcs Disposable Face Masks, Black Face Mask, 3 Ply Disposable Mask",Good masks,5.0,Good fit
"100Pcs Disposable Face Masks, Black Face Mask, 3 Ply Disposable Mask",It’s a mask,4.0,"Cheaper than at the local store, love the black color, some in the pack are better quality than others. The ear straps break easily on some and not on others."
"100Pcs Disposable Face Masks, Black Face Mask, 3 Ply Disposable Mask",Good buy,5.0,Light weight
"100Pcs Disposable Face Masks, Black Face Mask, 3 Ply Disposable Mask",SINGLE  PLY !!!,1.0,These masks are SINGLE ply.  Much less protective against covid.  They also have a very unpleasant odor.
"100Pcs Disposable Face Masks, Black Face Mask, 3 Ply Disposable Mask",Loke,5.0,Like
"100Pcs Disposable Face Masks, Black Face Mask, 3 Ply Disposable Mask",GREAT MASKS,5.0,Great masks!  They do not smell. Do not come apart like some people say
"100Pcs Disposable Face Masks, Black Face Mask, 3 Ply Disposable Mask",Waste,1.0,They’re unlined. They’re really just one thin piece of black mask. Waste of money
"100Pcs Disposable Face Masks, Black Face Mask, 3 Ply Disposable Mask",Great Masks,5.0,These are the perfect lightweight masks!
"100Pcs Disposable Face Masks, Black Face Mask, 3 Ply Disposable Mask",Great quality,5.0,Comfortable to wear/ super value and great quality masks.
"100Pcs Disposable Face Masks, Black Face Mask, 3 Ply Disposable Mask",They do what is necessary!!,5.0,They do the trick!!
"100Pcs Disposable Face Masks, Black Face Mask, 3 Ply Disposable Mask",Terrible quality,1.0,Horrible quality. Every single mask has metal poking out from the nose piece and the white stitching around the metal piece shows through the front of the black mask. They look terrible and are dangerous.
"100Pcs Disposable Face Masks, Black Face Mask, 3 Ply Disposable Mask",Good but some were defective.,3.0,"These are nice masks, but I received about 10 with only one ear string."
"100Pcs Disposable Face Masks, Black Face Mask, 3 Ply Disposable Mask",Las mejores,5.0,Excelente calidad
"100Pcs Disposable Face Masks, Black Face Mask, 3 Ply Disposable Mask",Comfort,5.0,Value for money
"100Pcs Disposable Face Masks, Black Face Mask, 3 Ply Disposable Mask",Feels paper thin,1.0,"Great price for the quantity, but working in the medical field I know these are not GREAT quality. They feel super thin, they get stuck to my mouth when speaking. Poor quality. I guess quantity over quality is no match."
"100Pcs Disposable Face Masks, Black Face Mask, 3 Ply Disposable Mask",i can breath in these mask,5.0,love these
"100Pcs Disposable Face Masks, Black Face Mask, 3 Ply Disposable Mask",I like the color n the fit!,5.0,Great for the price! Nice fit around the face! I'd purchase them again.
"100Pcs Disposable Face Masks, Black Face Mask, 3 Ply Disposable Mask",Not a good purchase,3.0,Some of the masks did not have the metal band across the nose
"100Pcs Disposable Face Masks, Black Face Mask, 3 Ply Disposable Mask","Chemical smell, paper thin",1.0,"These masks are horrible. The material is paper thin, it is not 3-ply. And most importantly it has a chemical smell that made me short of breath. I had to completely throw the entire batch in the trash. I DO NOT RECOMMEND."
"100Pcs Disposable Face Masks, Black Face Mask, 3 Ply Disposable Mask",Cheap for a reason!,1.0,Better to spend a few extra bucks for better quality! You get great quantity but quality is horrible! Took 3 in a row out of packaging and all 3 the ear-loop broke immediately! Not worth saving a few bucks for! You will end up using much faster anyways!
"100Pcs Disposable Face Masks, Black Face Mask, 3 Ply Disposable Mask",I would not recommend.,2.0,The bottom left strap broke every single time.  The mask was not sturdy at all. They looked nice but they broke way too easily.
"100Pcs Disposable Face Masks, Black Face Mask, 3 Ply Disposable Mask",DON'T BUY THIS,1.0,These masks are horrible. I don't know what type of lightweight glue they're using to put these together but they fall apart. I've literally already thrown 5 away because they tear apart so easily......buy your masks elsewhere please
"100Pcs Disposable Face Masks, Black Face Mask, 3 Ply Disposable Mask",Cheapest Mask Ever,1.0,"The left ear loop snaps so easily. I opened a brand new package and every single one out of the first 5 broke that when we tried. I finally got one that didnt snap and within wearing it for 2 hours, the ear loop broke.  What A waste!"
"100Pcs Disposable Face Masks, Black Face Mask, 3 Ply Disposable Mask",Great fit & professionally made. Would definitely recommend & buy again.,5.0,Great Purchase!
"100Pcs Disposable Face Masks, Black Face Mask, 3 Ply Disposable Mask",Comfortable and Durable,5.0,"These mask are great. They're durable, easy to put on, and comfortable.  Definitely a great purchase."
"100Pcs Disposable Face Masks, Black Face Mask, 3 Ply Disposable Mask","NOT 3 PLY.  This is the same thin mask you'll find anywhere, providing minimal protection.",2.0,This would've provided a false sense of protection.
"100Pcs Disposable Face Masks, Black Face Mask, 3 Ply Disposable Mask",Worth wearing the Mask,5.0,The mask is worth the little money spent.
"100Pcs Disposable Face Masks, Black Face Mask, 3 Ply Disposable Mask",Quality mask for everyone.,4.0,Ordered for my daughter and she loves them. Enough said. Great product.
"100Pcs Disposable Face Masks, Black Face Mask, 3 Ply Disposable Mask",They work,5.0,They work
"100Pcs Disposable Face Masks, Black Face Mask, 3 Ply Disposable Mask",The nose piece comes out easily,3.0,"They overall do exactly what they are supposed to do, protect you from breathing in, or exhaling, germs. That being said, the wire to shape the nose comes out super easy on about every other mask."
"100Pcs Disposable Face Masks, Black Face Mask, 3 Ply Disposable Mask",Nice but lacks medical quality.,3.0,The fabric seems too thin to keep allergens out and ones own contagious health concerns in.
"100Pcs Disposable Face Masks, Black Face Mask, 3 Ply Disposable Mask",Not 3 ply,3.0,These seem to be one ply. They are very thin and the elastics are a bit short.
"100Pcs Disposable Face Masks, Black Face Mask, 3 Ply Disposable Mask",More comfort mask,5.0,It was a needed item that I found more comfortable than the material mask that seem to smother you. Air seems to flow freely with these mask.
"100Pcs Disposable Face Masks, Black Face Mask, 3 Ply Disposable Mask",Cheap,1.0,"Don’t waste your money, majority break very fast or some don’t have ear loops"
"100Pcs Disposable Face Masks, Black Face Mask, 3 Ply Disposable Mask",Comfortable to wear.,5.0,Great face cover and comfortable to wear.
"100Pcs Disposable Face Masks, Black Face Mask, 3 Ply Disposable Mask",The ear loops break easily.,2.0,"These are cheap and you get what you pay for with these. The ear loops break very easily, which means you go through them twice as fast, so really they aren't any cheaper. I will not buy these again."
"100Pcs Disposable Face Masks, Black Face Mask, 3 Ply Disposable Mask",Masks are smelly,3.0,The masks fit fine. BUT there is a smell to them. Don't know if it's the dye or smell of being put up. I guess it thru what they say. You get what you paid for.
"100Pcs Disposable Face Masks, Black Face Mask, 3 Ply Disposable Mask",Perfect fit!,5.0,Masks were exactly what I expected.  They fit comfortably and aren’t too loose.  They fit all the teens and adults in my house.  Fast shipping too!
"100Pcs Disposable Face Masks, Black Face Mask, 3 Ply Disposable Mask",Comfortable,5.0,Comfortable
"100Pcs Disposable Face Masks, Black Face Mask, 3 Ply Disposable Mask",Bad smell,1.0,Smells horrible (like B.O.)!! Also super thin.
"100Pcs Disposable Face Masks, Black Face Mask, 3 Ply Disposable Mask",Great value,5.0,Great value for the price and very durable.
"100Pcs Disposable Face Masks, Black Face Mask, 3 Ply Disposable Mask",Highly not recommended,1.0,These smelt like hair spray. They made me sick. Another coworker got the same ones and said the same. There is some kind of chemical in them that should not be inhaled. Horrible!!! Buy American made masks not China.
"100Pcs Disposable Face Masks, Black Face Mask, 3 Ply Disposable Mask",Good mask,5.0,"Good price, comfortable"
"100Pcs Disposable Face Masks, Black Face Mask, 3 Ply Disposable Mask",Very thin,3.0,Very very thin material
"100Pcs Disposable Face Masks, Black Face Mask, 3 Ply Disposable Mask",Just ok.,2.0,The nose piece should be adjustable but isn’t. Don’t get these masks if you wear glasses.
"100Pcs Disposable Face Masks, Black Face Mask, 3 Ply Disposable Mask",Lightweight and comfortable,5.0,"I love that these masks are lightweight and have an adjustable nose piece, but they are a little big for my face.  I have to fold the bottom up to avoid my eyes being affected."
"100Pcs Disposable Face Masks, Black Face Mask, 3 Ply Disposable Mask","Need a mask, purchase these",5.0,"So if you got to wear a mask, these worked just fine. The price was better than in store prices."
"100Pcs Disposable Face Masks, Black Face Mask, 3 Ply Disposable Mask",Bad batch,2.0,"I have bought these before and they worked great. This batch, however, had about 1/2 of the masks that did not work. One of the elastic bands on each of the masks broke as soon as you would stretch it to put it on."
"100Pcs Disposable Face Masks, Black Face Mask, 3 Ply Disposable Mask",n/a,2.0,It doesn't bridge over the nose well. No matter how much I adjust it.
"100Pcs Disposable Face Masks, Black Face Mask, 3 Ply Disposable Mask",Love it,5.0,We love the masks
"100Pcs Disposable Face Masks, Black Face Mask, 3 Ply Disposable Mask",Works very well. Great value,5.0,Works very well. Great value. Comes in a sealable bag
"100Pcs Disposable Face Masks, Black Face Mask, 3 Ply Disposable Mask",Great Fit,5.0,
"100Pcs Disposable Face Masks, Black Face Mask, 3 Ply Disposable Mask",Mask,4.0,Provide excellent coverage. The metal shape ware for the nose tends to come off but still wearable.
"100Pcs Disposable Face Masks, Black Face Mask, 3 Ply Disposable Mask",Worthless.,2.0,"Incredibly thin. Only one layer, no indication which side faces out. It's a mesh you can even see through."
"100Pcs Disposable Face Masks, Black Face Mask, 3 Ply Disposable Mask",It’s the quality and quantity,5.0,This product has both quality and quantity! It also looks way better than regular face masks. Super recommended
"100Pcs Disposable Face Masks, Black Face Mask, 3 Ply Disposable Mask",100pc disposable black masks.no worthy.,1.0,"There is no protection from these masks, there's no layers of protection. Don't buy this item. I will return them. No happy with this purchase."
"100Pcs Disposable Face Masks, Black Face Mask, 3 Ply Disposable Mask",Smelled like smoke,2.0,Reordered masks for my daughter for school. Package arrived earlier in the day which was great. Product packaging wreaked of cigarettes. Absolutely disgusting. Will not reorder again.
"100Pcs Disposable Face Masks, Black Face Mask, 3 Ply Disposable Mask",It’s just a mask,5.0,"I wasn’t expecting much. It’s a tad bit rough, almost like a paper material. However, I’m not expecting much because it’s disposable. I don’t have any complaints, they don’t fall apart, they last each day I use them, and the straps aren’t annoying."
"100Pcs Disposable Face Masks, Black Face Mask, 3 Ply Disposable Mask",Nice product,5.0,Good value for the money
"100Pcs Disposable Face Masks, Black Face Mask, 3 Ply Disposable Mask",Great mask,5.0,Comfortable and works as it should
"100Pcs Disposable Face Masks, Black Face Mask, 3 Ply Disposable Mask",Worth it!!!,5.0,Just received them love the packaging sealed and all. I did make sure to smell them since some reviews stated a chemical smell. Mine don’t smell I’m happy also they are very thick compared to other mask that I had bought on Amazon.
"100Pcs Disposable Face Masks, Black Face Mask, 3 Ply Disposable Mask",About 20 were defective,2.0,Everything is good with the masks except about 20 of them did not have the left side string attachment and had to be thrown away.
"100Pcs Disposable Face Masks, Black Face Mask, 3 Ply Disposable Mask","Quality of product , very durable",5.0,I like the durability and comfort as well as the quality of product. I’d give it a 10 star if I could. Use product for COVID requirements in public.
"100Pcs Disposable Face Masks, Black Face Mask, 3 Ply Disposable Mask",comfortable,5.0,Great value for money and comfortable
"100Pcs Disposable Face Masks, Black Face Mask, 3 Ply Disposable Mask",Perfect for Work,5.0,"These are perfect!! I work long hours in food service and this keeps me covered while still being breathable, comfortable, and stylish!"
"100Pcs Disposable Face Masks, Black Face Mask, 3 Ply Disposable Mask",Horrible,1.0,These mask are super lightweight and break way to easy! I wouldn’t recommend.
"100Pcs Disposable Face Masks, Black Face Mask, 3 Ply Disposable Mask",The masks will get the job done,5.0,Very fast and a good product
"100Pcs Disposable Face Masks, Black Face Mask, 3 Ply Disposable Mask",Too stiff.,2.0,To stiff and uncomfortable. Started with an odor that I couldn’t deal with.
"100Pcs Disposable Face Masks, Black Face Mask, 3 Ply Disposable Mask",Horrible,1.0,Not worth the money!
"100Pcs Disposable Face Masks, Black Face Mask, 3 Ply Disposable Mask",Do not purchase,1.0,Smell bad and poor quality....very very thin layer
"100Pcs Disposable Face Masks, Black Face Mask, 3 Ply Disposable Mask",Worst made masks ever!,1.0,These masks are cheaply made. The nose bend part comes out every time we try to use them. Looks like a cheap bread tie. Does not protect or stay together.
"100Pcs Disposable Face Masks, Black Face Mask, 3 Ply Disposable Mask",Trash,1.0,These mask are garbage. I go through 2 to 5 of them in a 5 hour shift. The elastic straps breaks very easily. Typically I can wear a single mask for days.
"100Pcs Disposable Face Masks, Black Face Mask, 3 Ply Disposable Mask",Masks,5.0,"Breathable, light, comfortable."
"100Pcs Disposable Face Masks, Black Face Mask, 3 Ply Disposable Mask",Great Masks,5.0,These masks were very comfortable and kept me protected on a daily basis in public
"100Pcs Disposable Face Masks, Black Face Mask, 3 Ply Disposable Mask",Only was able to use half the box,1.0,Have the mask in the box was missing straps for the less ear.
"100Pcs Disposable Face Masks, Black Face Mask, 3 Ply Disposable Mask",Thick but breathable,5.0,"Worth it, just get it!"
"100Pcs Disposable Face Masks, Black Face Mask, 3 Ply Disposable Mask",Do not buy,1.0,"Terrible quality. Better off hole-punching a piece of paper and tying string to it. No contour to the face, looks like a large square in front of your mouth. Not usable in my opinion, will have to buy a different brand."
"100Pcs Disposable Face Masks, Black Face Mask, 3 Ply Disposable Mask",great deal,5.0,Lightweight and comfortable
"100Pcs Disposable Face Masks, Black Face Mask, 3 Ply Disposable Mask",Good for returning to the masked world,5.0,Time for kids to go back to school. My son will have to wear them daily and these work well. Plus he will actually wear it correctly.
"100Pcs Disposable Face Masks, Black Face Mask, 3 Ply Disposable Mask",Satisfied customer,5.0,"Very happy with my purchase, comfortable and a good fit. 🙂"
"100Pcs Disposable Face Masks, Black Face Mask, 3 Ply Disposable Mask",Not 3 ply as stated.,1.0,"The product doesn’t seem to be 3 ply, I have to wear 2 masks to feel protected."
"100Pcs Disposable Face Masks, Black Face Mask, 3 Ply Disposable Mask",I like everything about this mask,5.0,Overall nice quality
"100Pcs Disposable Face Masks, Black Face Mask, 3 Ply Disposable Mask",Comfortable,5.0,"I liked that this mask was comfortable, light weight and soft on the ears. It don't think it's 3 ply though but it fits just right. I will definitely be buying more!"
"100Pcs Disposable Face Masks, Black Face Mask, 3 Ply Disposable Mask",Cheap,2.0,"These are are cheaply made, will not purchase again. The straps break pulling them over my ears. I have to bring a few in case one breaks, which they always do."
"100Pcs Disposable Face Masks, Black Face Mask, 3 Ply Disposable Mask",GREAT!,5.0,recommend highly!
"100Pcs Disposable Face Masks, Black Face Mask, 3 Ply Disposable Mask",They were too loose and don't fit my face.,1.0,Don't fit well...too loose.A waist of my money.
"100Pcs Disposable Face Masks, Black Face Mask, 3 Ply Disposable Mask",I’m really disappointed they were very stiff and uncomfortable,1.0,"I was dissatisfied, they were stiff and hard on the nose, I’m a health care worker, I would return them but I opened the package. I had to go re buy some at Costco"
"100Pcs Disposable Face Masks, Black Face Mask, 3 Ply Disposable Mask",They Break Too Easily!,1.0,They’re just great masks in every way except if you go to put them on and barely pull the string even slightly too hard it breaks. Immediately comes right off and it’s useless.  So bottom line these things are worth nothing.
"100Pcs Disposable Face Masks, Black Face Mask, 3 Ply Disposable Mask",Cheap cheap cheap,1.0,This are horrible. Do not buy.
"100Pcs Disposable Face Masks, Black Face Mask, 3 Ply Disposable Mask",Does not get fuzzy inside,5.0,"Perfect, others get fuzzy inside this one does not."
"100Pcs Disposable Face Masks, Black Face Mask, 3 Ply Disposable Mask",Don’t do it,1.0,They are very cheap they are not 3 ply they are barely 1 it’s see-through and cheap it’s not protecting nothing it was a waste of my money
"100Pcs Disposable Face Masks, Black Face Mask, 3 Ply Disposable Mask",Very Comfortable.,5.0,These are way more comfortable then and other disposable mask or cloth masks. They are very nice.
"100Pcs Disposable Face Masks, Black Face Mask, 3 Ply Disposable Mask",Poor quality,1.0,"These mask are made of very poor quality. The side does not fit close to face and the elastic that goes around the ear is to long, therefore you have to twist it about 3 to 4 times in order to fit it to your face!"
"100Pcs Disposable Face Masks, Black Face Mask, 3 Ply Disposable Mask",No wire for your nose in the masks,1.0,Only the first few masks came with the wire so that you can create a snug fit around your nose. Don’t buy them! I feel like I was tricked!
"100Pcs Disposable Face Masks, Black Face Mask, 3 Ply Disposable Mask",Got to have one,5.0,required at school
"100Pcs Disposable Face Masks, Black Face Mask, 3 Ply Disposable Mask",Disappointed,1.0,Almost every single mask ear strap has snapped  n broken within mins to an hour. I bought another brand of masks similar awhile back they were very durable….these however are poor quality!!!
"100Pcs Disposable Face Masks, Black Face Mask, 3 Ply Disposable Mask",Buenas,5.0,Buena compra
"100Pcs Disposable Face Masks, Black Face Mask, 3 Ply Disposable Mask",Stinky stinky,1.0,"Strong smell, not great for something to wear over your face"
