product,title,rating,content
"100Pcs Disposable Face Masks, Black Face Mask, 3 Ply Disposable Mask",Paper thin!!!,1.0,I’ve purchased better quality masks on Amazon but there’s are not it. So thin!!
"100Pcs Disposable Face Masks, Black Face Mask, 3 Ply Disposable Mask",Nice masks,5.0,Nice masks. Ordered when they went on sale. They’re very fitting.
"100Pcs Disposable Face Masks, Black Face Mask, 3 Ply Disposable Mask",Nice black masks,5.0,Lightweight. Easy to wear
"100Pcs Disposable Face Masks, Black Face Mask, 3 Ply Disposable Mask",Snap really easily,3.0,About 1 out of 5 snap right when I put them on or shortly after
"100Pcs Disposable Face Masks, Black Face Mask, 3 Ply Disposable Mask",Meets expectations,4.0,Everyday use.
"100Pcs Disposable Face Masks, Black Face Mask, 3 Ply Disposable Mask",I don’t recommend them .,1.0,These face masks are not comfortable.
"100Pcs Disposable Face Masks, Black Face Mask, 3 Ply Disposable Mask",Does the job in a pinch,3.0,Overall the mask does the job but has a strong chemical odor when the package is initially opened.
"100Pcs Disposable Face Masks, Black Face Mask, 3 Ply Disposable Mask",They great fit,5.0,They were perfect kids love the black
"100Pcs Disposable Face Masks, Black Face Mask, 3 Ply Disposable Mask",Perfect mask for all day use,5.0,The mask is protective but light weight enough to all workplace wear all day.
"100Pcs Disposable Face Masks, Black Face Mask, 3 Ply Disposable Mask",Poor seal onto face,2.0,Does not conform to face well enough (poor molding over nose) to properly seal
"100Pcs Disposable Face Masks, Black Face Mask, 3 Ply Disposable Mask",Wear a mask!,5.0,"If you don't want to protect yourself, protect your family!"
"100Pcs Disposable Face Masks, Black Face Mask, 3 Ply Disposable Mask",Wire in the nose area is NOT durable!!!,1.0,I don’t like it because the wire on the nose part is not strong. It’s just too flobby.
"100Pcs Disposable Face Masks, Black Face Mask, 3 Ply Disposable Mask",Not cheaply made.,5.0,These work great!
"100Pcs Disposable Face Masks, Black Face Mask, 3 Ply Disposable Mask",Good for spring & Summer wear.,5.0,"Lightweight, affordable"
"100Pcs Disposable Face Masks, Black Face Mask, 3 Ply Disposable Mask","Very poor quality, most broke on first wear",1.0,"Poor quality, over 50% of masks broke first time they were worn and wire popped out as well"
"100Pcs Disposable Face Masks, Black Face Mask, 3 Ply Disposable Mask",Works well for me.,5.0,Fits well works well.
"100Pcs Disposable Face Masks, Black Face Mask, 3 Ply Disposable Mask",Face masks,1.0,I will not be purchasing again the straps break loose very easily bad design
"100Pcs Disposable Face Masks, Black Face Mask, 3 Ply Disposable Mask",Not functional,1.0,There isn’t anything in the nose so that it will stay on your face. Too tight on the ears.
"100Pcs Disposable Face Masks, Black Face Mask, 3 Ply Disposable Mask",Great affordable product,5.0,Reliable masks. Using them for school.
"100Pcs Disposable Face Masks, Black Face Mask, 3 Ply Disposable Mask",Good product,5.0,Daily use
"100Pcs Disposable Face Masks, Black Face Mask, 3 Ply Disposable Mask",Reasonable price,5.0,What I expected
"100Pcs Disposable Face Masks, Black Face Mask, 3 Ply Disposable Mask",Black mask,5.0,"It’s a good disposable mask, besides getting them the next day.|"
"100Pcs Disposable Face Masks, Black Face Mask, 3 Ply Disposable Mask",Has an odd petroleum type smell,1.0,"Fit was good, but the smell is so bad I can’t use them."
"100Pcs Disposable Face Masks, Black Face Mask, 3 Ply Disposable Mask",smell terrible and poor quality,1.0,smell terrible and poor quality (cheap)
"100Pcs Disposable Face Masks, Black Face Mask, 3 Ply Disposable Mask","SMELLS AWFUL, POOR QUALITY",1.0,"These masks smell awful, very poor quality, no backing on them, the worst masks I have ever purchased, sending them back asap."
"100Pcs Disposable Face Masks, Black Face Mask, 3 Ply Disposable Mask",great mask! lightweight and breathable,5.0,I loveeee this black masks. I look so good in them. They’re comfortable and nice.
"100Pcs Disposable Face Masks, Black Face Mask, 3 Ply Disposable Mask",The straps break with just a little pressure on some of them,2.0,Some of the masks are fine but others break when I’m just trying to pull them out of the package
"100Pcs Disposable Face Masks, Black Face Mask, 3 Ply Disposable Mask",Cheap,1.0,"Not Sterile for sure. Came in a open bag, kind of just tossed in there, not neatly piled or in a box."
"100Pcs Disposable Face Masks, Black Face Mask, 3 Ply Disposable Mask",Not as advertised. Single layer,1.0,Product only has one single layer and straps easily break. Please don’t waist your money.
"100Pcs Disposable Face Masks, Black Face Mask, 3 Ply Disposable Mask",Don’t buy.,2.0,Mask smells very bad.
"100Pcs Disposable Face Masks, Black Face Mask, 3 Ply Disposable Mask",Great for grab and go,5.0,My go to mask for school
"100Pcs Disposable Face Masks, Black Face Mask, 3 Ply Disposable Mask",Good buy,5.0,Great value for money
"100Pcs Disposable Face Masks, Black Face Mask, 3 Ply Disposable Mask",Masks,5.0,They are very light weight and stretchy. They are very convenient to have.
"100Pcs Disposable Face Masks, Black Face Mask, 3 Ply Disposable Mask",Size and comfortable,5.0,Could be a little bigger
"100Pcs Disposable Face Masks, Black Face Mask, 3 Ply Disposable Mask",cheap material feels like plastic,1.0,cheap material feels like plastic
"100Pcs Disposable Face Masks, Black Face Mask, 3 Ply Disposable Mask",Cheap junk,1.0,The mask come apart on the inside. Fibers get in your mouth.
"100Pcs Disposable Face Masks, Black Face Mask, 3 Ply Disposable Mask",These are a low quality mask.,1.0,They are very thin and we had to double up on them.  I would not recommend this product.
"100Pcs Disposable Face Masks, Black Face Mask, 3 Ply Disposable Mask",It’s a gift!,5.0,This is a gift!
"100Pcs Disposable Face Masks, Black Face Mask, 3 Ply Disposable Mask",Show me the Masks 😷,5.0,Value for the money is absolutely worth it!!!
"100Pcs Disposable Face Masks, Black Face Mask, 3 Ply Disposable Mask",Great masks,5.0,These masks are perfect for everyday wear.  They are lightweight and comfortable.
"100Pcs Disposable Face Masks, Black Face Mask, 3 Ply Disposable Mask",Comfort,5.0,Fits perfect over my nose to stop fogging of my glasses
"100Pcs Disposable Face Masks, Black Face Mask, 3 Ply Disposable Mask",Definitely would buy again,5.0,Nice quality product
"100Pcs Disposable Face Masks, Black Face Mask, 3 Ply Disposable Mask",Love them,5.0,Great mask
"100Pcs Disposable Face Masks, Black Face Mask, 3 Ply Disposable Mask",Very disappointing,1.0,These masks break when we try to put them on our faces very disappointing
"100Pcs Disposable Face Masks, Black Face Mask, 3 Ply Disposable Mask",So do,3.0,They tear easily from one side.
"100Pcs Disposable Face Masks, Black Face Mask, 3 Ply Disposable Mask",Poorly made strings broke immediately,1.0,Poor quality
"100Pcs Disposable Face Masks, Black Face Mask, 3 Ply Disposable Mask",Smells bad,3.0,Smells bad - I immediately put them in the dryer with a dryer sheet to freshen them up
"100Pcs Disposable Face Masks, Black Face Mask, 3 Ply Disposable Mask",This mask fits well and is very comfortable.,5.0,This mask fits well and is very comfortable.
"100Pcs Disposable Face Masks, Black Face Mask, 3 Ply Disposable Mask",Mask,5.0,Great mask
"100Pcs Disposable Face Masks, Black Face Mask, 3 Ply Disposable Mask",These mask were reasonably priced,4.0,The mask were just a little loose but other than that it's a good price
"100Pcs Disposable Face Masks, Black Face Mask, 3 Ply Disposable Mask",The clip that holds on the pulls out so it’s below expectations,1.0,I don’t like the clip that holds on the nose it pulls out
"100Pcs Disposable Face Masks, Black Face Mask, 3 Ply Disposable Mask",Easy to put on but not completely comfortable,5.0,After a while it hurts my ear.
"100Pcs Disposable Face Masks, Black Face Mask, 3 Ply Disposable Mask",BEST MASKS FOR A GLOBAL PANDEMIC,5.0,The best masks I’ve used all pandemic so comfy they don’t get fuzzy like most disposable masks and they’re soo light weight and they aren't hot!!
"100Pcs Disposable Face Masks, Black Face Mask, 3 Ply Disposable Mask",These black masks are comfortable and far more classy than the blue surgical masks.,5.0,The black masks are comfortable and classy.
"100Pcs Disposable Face Masks, Black Face Mask, 3 Ply Disposable Mask",Bummer,2.0,Loops break easily. Won’t buy again.
"100Pcs Disposable Face Masks, Black Face Mask, 3 Ply Disposable Mask",Not worth a purchase,1.0,The mask stinks and of cheap quality.Recommend not to buy it !!!
"100Pcs Disposable Face Masks, Black Face Mask, 3 Ply Disposable Mask",Very comfortable and breathable,5.0,"This mask is comfortable, breathable, and black goes with everything!"
"100Pcs Disposable Face Masks, Black Face Mask, 3 Ply Disposable Mask",Fits face better than others.,5.0,Great value.  Very nice. Mask will be needed either by choice  or mandate. So I just wanted to be prepared. Nice.
"100Pcs Disposable Face Masks, Black Face Mask, 3 Ply Disposable Mask",Versatile and goes with anything you wear!,5.0,Lightweight and easy to wear. Better than the blue masks they hand out in healthcare
"100Pcs Disposable Face Masks, Black Face Mask, 3 Ply Disposable Mask",Cheap,1.0,Cheaply made
"100Pcs Disposable Face Masks, Black Face Mask, 3 Ply Disposable Mask",Mask without strings on one side,2.0,I did not like that 10 mask that I’ve seen so far had missing strings.
"100Pcs Disposable Face Masks, Black Face Mask, 3 Ply Disposable Mask",A total scam,1.0,This product is horrible. Masks are see through and thin. Ear loops snap very easily. Waste of money
"100Pcs Disposable Face Masks, Black Face Mask, 3 Ply Disposable Mask",Break easily,1.0,The straps easily broke when putting it on
"100Pcs Disposable Face Masks, Black Face Mask, 3 Ply Disposable Mask",Comfortable,4.0,I have used these for the last 2 flights I’ve worked. I like them. They are comfortable for a 12 hour work day.
"100Pcs Disposable Face Masks, Black Face Mask, 3 Ply Disposable Mask",They stay in place better than any others we have tried.,5.0,Used them outside of our house.
"100Pcs Disposable Face Masks, Black Face Mask, 3 Ply Disposable Mask",Doesn’t have Nose clip,1.0,Does not have a nose clip on half of the masks
"100Pcs Disposable Face Masks, Black Face Mask, 3 Ply Disposable Mask","We love them, matches with everything I wear.",5.0,We love them matches with everything wear.
"100Pcs Disposable Face Masks, Black Face Mask, 3 Ply Disposable Mask",Too flimsy,1.0,"The masks are very flimsy, the string breaks every time I put one on."
"100Pcs Disposable Face Masks, Black Face Mask, 3 Ply Disposable Mask",Never buy again,1.0,This mask broke with even the slightest tug to the straps. Absolute waste of money.
"100Pcs Disposable Face Masks, Black Face Mask, 3 Ply Disposable Mask",Separate them in packs of 10.,5.0,Best bang for the buck. Good amount for a great price.
"100Pcs Disposable Face Masks, Black Face Mask, 3 Ply Disposable Mask",Great protection,5.0,"Face masks , these great!!!!"
"100Pcs Disposable Face Masks, Black Face Mask, 3 Ply Disposable Mask",I wear two... better safe than sorry,5.0,I prefer the black
"100Pcs Disposable Face Masks, Black Face Mask, 3 Ply Disposable Mask",Mask review,1.0,The quality is not upto mark and the elastic straps are loose and breakoff easily.
"100Pcs Disposable Face Masks, Black Face Mask, 3 Ply Disposable Mask",Very comfortable,5.0,Very light and easier to breath
"100Pcs Disposable Face Masks, Black Face Mask, 3 Ply Disposable Mask",Smelly And Breakable,1.0,They smell bad and rip easily. Do not recommend.
"100Pcs Disposable Face Masks, Black Face Mask, 3 Ply Disposable Mask",I do not recommend this product,1.0,"Masks do not stay on your face, the metal strip does not squeeze together. Not a good product."
"100Pcs Disposable Face Masks, Black Face Mask, 3 Ply Disposable Mask",Ok product,4.0,Product was ok but should have packed better.Mask was in a ziplock type bag.
"100Pcs Disposable Face Masks, Black Face Mask, 3 Ply Disposable Mask",Not a quality mask,2.0,"Product is very thin. Also, the wire piece in the nose breaks through very easily."
"100Pcs Disposable Face Masks, Black Face Mask, 3 Ply Disposable Mask",Perfect Fit,5.0,The mask is very light weight and fits well with my glasses...
"100Pcs Disposable Face Masks, Black Face Mask, 3 Ply Disposable Mask",Met my expectations.,5.0,I got exactly what I expected.
"100Pcs Disposable Face Masks, Black Face Mask, 3 Ply Disposable Mask",Not a great product.,1.0,These masks are not 3-ply. They are very flimsy and they smell horrible.
"100Pcs Disposable Face Masks, Black Face Mask, 3 Ply Disposable Mask",Ty!,5.0,:)
"100Pcs Disposable Face Masks, Black Face Mask, 3 Ply Disposable Mask",Cheap flimsy,1.0,Better off not wearing a mask. Offers zero protection
"100Pcs Disposable Face Masks, Black Face Mask, 3 Ply Disposable Mask",Smells,2.0,The masks are comfortable but smell like chemicals.
"100Pcs Disposable Face Masks, Black Face Mask, 3 Ply Disposable Mask",Chemical odor,1.0,I was disappointed that the masks smelled like chemicals even after I aired them out.  Will be returning them.
"100Pcs Disposable Face Masks, Black Face Mask, 3 Ply Disposable Mask",Mascarillas,5.0,"Me agrada este producto, muy útil y me gusta como están acomodados en la bolsa de plástico, están cómodos y precio accesible."
"100Pcs Disposable Face Masks, Black Face Mask, 3 Ply Disposable Mask",Protection against viruses unlikely,2.0,Product fits well however they seem thin and lacking protection against anything.
"100Pcs Disposable Face Masks, Black Face Mask, 3 Ply Disposable Mask",Nice!,5.0,They are very comfortable.
"100Pcs Disposable Face Masks, Black Face Mask, 3 Ply Disposable Mask",Smell,3.0,The overall quality was great! But they just have an awful smell
"100Pcs Disposable Face Masks, Black Face Mask, 3 Ply Disposable Mask",Exactly What I Ordered,5.0,They were exactly as shown.
"100Pcs Disposable Face Masks, Black Face Mask, 3 Ply Disposable Mask",fits well,5.0,very satisfied
"100Pcs Disposable Face Masks, Black Face Mask, 3 Ply Disposable Mask",Son de mala calidad se rompen con solo intentar colocarlas,5.0,Son de mala calidad la elástica se romper al colocarte la máscara
"100Pcs Disposable Face Masks, Black Face Mask, 3 Ply Disposable Mask",Stained,2.0,"Stained my face actually, and I was thinking they were good and bruised my ears."
"100Pcs Disposable Face Masks, Black Face Mask, 3 Ply Disposable Mask",Shreds easy when wet,5.0,Thin and shred when wet
"100Pcs Disposable Face Masks, Black Face Mask, 3 Ply Disposable Mask",Break easily,2.0,Break easily
"100Pcs Disposable Face Masks, Black Face Mask, 3 Ply Disposable Mask",Terrible quality,1.0,Terrible.  Every single mask has broken and fallen apart.  I will not buy these again.
"100Pcs Disposable Face Masks, Black Face Mask, 3 Ply Disposable Mask",Disappointed,1.0,These masks are thin and cheaply made.
"100Pcs Disposable Face Masks, Black Face Mask, 3 Ply Disposable Mask",Missing nose bridge wires,1.0,A majority of the masks are missing the nose bridge wire.
"100Pcs Disposable Face Masks, Black Face Mask, 3 Ply Disposable Mask",They break very very easily. Will find another brand next time,1.0,I disliked that I could not even use one for a full day because they kept breaking
"100Pcs Disposable Face Masks, Black Face Mask, 3 Ply Disposable Mask",Great,5.0,Very nice and comfy
"100Pcs Disposable Face Masks, Black Face Mask, 3 Ply Disposable Mask",Great,5.0,Worth the money
"100Pcs Disposable Face Masks, Black Face Mask, 3 Ply Disposable Mask",Great masks!,5.0,My kids prefer these masks to all the others we’ve used.
"100Pcs Disposable Face Masks, Black Face Mask, 3 Ply Disposable Mask",Runs small,2.0,Adult size runs small. Presses nose in mask. Fits 10 year old more comfortable.
"100Pcs Disposable Face Masks, Black Face Mask, 3 Ply Disposable Mask",Thin mask,2.0,The mask was very thin and didn’t feel like it would protect you.
"100Pcs Disposable Face Masks, Black Face Mask, 3 Ply Disposable Mask",Poor quality,1.0,Strings are easily to break and kept breaking on most of the mask
"100Pcs Disposable Face Masks, Black Face Mask, 3 Ply Disposable Mask",Strings popping as soon as you put on,1.0,Strings popping as soon as you put on
"100Pcs Disposable Face Masks, Black Face Mask, 3 Ply Disposable Mask",Breaks easily,1.0,"During the day the strap broke on at least half of the masks, very poorly made."
"100Pcs Disposable Face Masks, Black Face Mask, 3 Ply Disposable Mask",Priceless,5.0,Perfect fit
"100Pcs Disposable Face Masks, Black Face Mask, 3 Ply Disposable Mask","Good, good, and really good",5.0,These masks are so 🔥. I feel protected af and I love the sleek black design. Will def buy again.
"100Pcs Disposable Face Masks, Black Face Mask, 3 Ply Disposable Mask",Great,5.0,Way better than the flimsy blue masks
"100Pcs Disposable Face Masks, Black Face Mask, 3 Ply Disposable Mask",overall pretty nice,4.0,they get fuzzy and old pretty quickly but other than that they are good masks.
"100Pcs Disposable Face Masks, Black Face Mask, 3 Ply Disposable Mask",Non-functioning plastic nose bridge strip,1.0,"The nose bridge strip is plastic that bounces back when bent. Result is a poor-fitting, gappy mask."
"100Pcs Disposable Face Masks, Black Face Mask, 3 Ply Disposable Mask",Stinky!!,1.0,These smell horrible!!! I can’t even bare to wear them for a minute. What a waste.
"100Pcs Disposable Face Masks, Black Face Mask, 3 Ply Disposable Mask",Love them,5.0,"shipped quick... easy to wear, great value"
"100Pcs Disposable Face Masks, Black Face Mask, 3 Ply Disposable Mask",Great,5.0,Great mask
"100Pcs Disposable Face Masks, Black Face Mask, 3 Ply Disposable Mask",The mask smelled.,1.0,The masked had a smelly odor. I can not wear mask that are not breathable due to an odor.
"100Pcs Disposable Face Masks, Black Face Mask, 3 Ply Disposable Mask",It’s cool,5.0,Nice
"100Pcs Disposable Face Masks, Black Face Mask, 3 Ply Disposable Mask",Defective,1.0,The nose pieces are falling out of every mask after wearing for a couple hours. Not worth it
"100Pcs Disposable Face Masks, Black Face Mask, 3 Ply Disposable Mask",Thin Do Not Order,1.0,"Very thin, do not order! Straps break very easily as well. Very poor quality."
"100Pcs Disposable Face Masks, Black Face Mask, 3 Ply Disposable Mask",Terrible smell unable to use,1.0,Do not purchase these they finally arrived and are not usable. Terrible smell
"100Pcs Disposable Face Masks, Black Face Mask, 3 Ply Disposable Mask",Falls apart really easy,3.0,Many times I used one the straps would tear free.
"100Pcs Disposable Face Masks, Black Face Mask, 3 Ply Disposable Mask",Good mask,5.0,"Very good mask,  lightweight and comfortable"
"100Pcs Disposable Face Masks, Black Face Mask, 3 Ply Disposable Mask",Elastic that goes around the ear breaks on every mask.,1.0,Defective
"100Pcs Disposable Face Masks, Black Face Mask, 3 Ply Disposable Mask",Don't purchase,2.0,The ear loops break almost immediately after putting the mask on!
"100Pcs Disposable Face Masks, Black Face Mask, 3 Ply Disposable Mask",Literally comes apart after wearing for 5 minutes,1.0,Not a great disposable mask.  Poorly made .
"100Pcs Disposable Face Masks, Black Face Mask, 3 Ply Disposable Mask",Smells,1.0,Smells like a horrible chemical. Cant even wear any of the masks given this horrible smell
"100Pcs Disposable Face Masks, Black Face Mask, 3 Ply Disposable Mask",Very stiff and ruff will wear on outside of cloth mask,2.0,Too ruff for face
"100Pcs Disposable Face Masks, Black Face Mask, 3 Ply Disposable Mask",Easy to use grab & dispose,5.0,Doesnt show makeup marks
"100Pcs Disposable Face Masks, Black Face Mask, 3 Ply Disposable Mask",Smells,1.0,"Very strong chemical smell, had to return"
"100Pcs Disposable Face Masks, Black Face Mask, 3 Ply Disposable Mask",Comfortable!,5.0,Great product!
"100Pcs Disposable Face Masks, Black Face Mask, 3 Ply Disposable Mask",1/2 of them were broken,1.0,Don’t buy. 1/2 broken
"100Pcs Disposable Face Masks, Black Face Mask, 3 Ply Disposable Mask",Not good,2.0,I do not reccomend this mask If you wear glasses it fogs your glass fast.
"100Pcs Disposable Face Masks, Black Face Mask, 3 Ply Disposable Mask",Fit great and light weight,5.0,Love these so much more than the blue and white paper ones!!!!
"100Pcs Disposable Face Masks, Black Face Mask, 3 Ply Disposable Mask",Masks are defective,1.0,Over 1/2 these masks don’t have all the strings.  They are useleSs.
"100Pcs Disposable Face Masks, Black Face Mask, 3 Ply Disposable Mask",it sucks,1.0,i very dislike the product never again. it’s very thin and not good for use.
"100Pcs Disposable Face Masks, Black Face Mask, 3 Ply Disposable Mask",Not the best fit,1.0,The fit is not comfortable for me. They don’t seem long enough.
"100Pcs Disposable Face Masks, Black Face Mask, 3 Ply Disposable Mask",Too thin lining cannot use these poor quality.,2.0,Too thin poor quality
"100Pcs Disposable Face Masks, Black Face Mask, 3 Ply Disposable Mask",Nose clip falls off easily,2.0,"The plastic piece for the nose comes off easily, rendering the mask useless"
"100Pcs Disposable Face Masks, Black Face Mask, 3 Ply Disposable Mask","Las mascarillas son de muy mala calidad, material barato y sencillo.",1.0,"El material de muy mala calidad, son las peores mascarillas que he comprado"
"100Pcs Disposable Face Masks, Black Face Mask, 3 Ply Disposable Mask",Pls do not buy,1.0,These were so horrible right when u try to put themOn the string from the ears would rip do not recommend
"100Pcs Disposable Face Masks, Black Face Mask, 3 Ply Disposable Mask",Ok,3.0,If you need mask for cheap price these are it nothing specs
"100Pcs Disposable Face Masks, Black Face Mask, 3 Ply Disposable Mask",Great deal!,5.0,Great price for the pack of 100. Very light weight and comfy will buy again
"100Pcs Disposable Face Masks, Black Face Mask, 3 Ply Disposable Mask",these rip as soon as you put them on,1.0,Sides fall apart we can't even use them
"100Pcs Disposable Face Masks, Black Face Mask, 3 Ply Disposable Mask",Mask fits perfectly.  Thank you!!!,5.0,"Ordered 100 mask.  Fits perfectly, very comfortable.  Thank you!!!"
"100Pcs Disposable Face Masks, Black Face Mask, 3 Ply Disposable Mask",Great quality and fast shipping!,5.0,I was shocked how fast these were delivered! Great quality masks.
"100Pcs Disposable Face Masks, Black Face Mask, 3 Ply Disposable Mask",Poor workmanship,3.0,The ear loops came loose from the mask and the nose peace was off center much too often
"100Pcs Disposable Face Masks, Black Face Mask, 3 Ply Disposable Mask",The Best Disposable Mask,5.0,We love that it's light weight and  breatheable to wear all day at school!
"100Pcs Disposable Face Masks, Black Face Mask, 3 Ply Disposable Mask",As advertised,5.0,I like that this product is as advertised and arrived on time!
"100Pcs Disposable Face Masks, Black Face Mask, 3 Ply Disposable Mask",N/A,5.0,Super lijeras
"100Pcs Disposable Face Masks, Black Face Mask, 3 Ply Disposable Mask",Good quality for the price,5.0,Good quality for the price. Affordable
"100Pcs Disposable Face Masks, Black Face Mask, 3 Ply Disposable Mask",Low price,5.0,Great pricing!
"100Pcs Disposable Face Masks, Black Face Mask, 3 Ply Disposable Mask",Great disposable mask,5.0,Like the black color
"100Pcs Disposable Face Masks, Black Face Mask, 3 Ply Disposable Mask",You  can  wear  it with  anything,5.0,It was comfortable
"100Pcs Disposable Face Masks, Black Face Mask, 3 Ply Disposable Mask",Great,5.0,Great
"100Pcs Disposable Face Masks, Black Face Mask, 3 Ply Disposable Mask",Is correct description,5.0,Great deal
"100Pcs Disposable Face Masks, Black Face Mask, 3 Ply Disposable Mask",Excellent workmanship,5.0,Very easy to wear & breath thru
"100Pcs Disposable Face Masks, Black Face Mask, 3 Ply Disposable Mask",Cheap,1.0,The mask string comes off when you wear it
"100Pcs Disposable Face Masks, Black Face Mask, 3 Ply Disposable Mask",Buy it!,5.0,Great value for the price!
"100Pcs Disposable Face Masks, Black Face Mask, 3 Ply Disposable Mask",Good quality,5.0,Good quality masks
"100Pcs Disposable Face Masks, Black Face Mask, 3 Ply Disposable Mask",Low quality and many not usable,1.0,Many of them are not usable and all of them have a terrible smell
"100Pcs Disposable Face Masks, Black Face Mask, 3 Ply Disposable Mask",It is good,5.0,I like it and i can breathe in it unlike the others
"100Pcs Disposable Face Masks, Black Face Mask, 3 Ply Disposable Mask",Comfortable & stretchy,5.0,Very comfortable and stretchy!
"100Pcs Disposable Face Masks, Black Face Mask, 3 Ply Disposable Mask",Missing ear straps,1.0,Most of the masks only had 1 ear strap.
"100Pcs Disposable Face Masks, Black Face Mask, 3 Ply Disposable Mask",Lack pot stretch ability,2.0,Tends to break with any small movement after it’s on my ear. Several have broke on me.
"100Pcs Disposable Face Masks, Black Face Mask, 3 Ply Disposable Mask",Not great quality,3.0,I have ordered other black masks.  This product was inferior.
"100Pcs Disposable Face Masks, Black Face Mask, 3 Ply Disposable Mask",Really great fit.,5.0,Great product.
"100Pcs Disposable Face Masks, Black Face Mask, 3 Ply Disposable Mask",Affordable face masks,5.0,I will buy again
"100Pcs Disposable Face Masks, Black Face Mask, 3 Ply Disposable Mask",Do not buy,1.0,Do not buy these they rip very easily and are very uncomfortable
"100Pcs Disposable Face Masks, Black Face Mask, 3 Ply Disposable Mask",It's worth it,5.0,Light weight and most importantly for me it doesn't itch or causes acne breakouts.
